file_name,text,sentiment,intention,offensiveness,source_text,target_text,source_id,target_id
image_ (1408).jpg,"WHAT DID GENE WILDER  

KNOW ABOUT HILLARY?
Our thoughts are with Gene  Wilder's family during this  difficult time",4,2,0,,,,
image_ (2179).jpg,"RACIST TEST:DO YOU LIKE HIM ANY BETTER WHITE?
NO?
ME NEITHER
SEE,YOU'RE NOT A RACIST",1,4,0,,,,
image_ (3031).jpg,"AH YOU'RE EXQUISITE, YOU MUST 
LET ME PAINT YOU. -
BARNEY STINSON",2,3,0,,,,
image_ (3646).jpg,"DO I MAKE YOU HORNY BABY
DO I,OH BEHAVE",1,1,0,,,,
image_ (945).jpg,"WHAT HAPPENED
THE MAJOR MOTION PICTURE RELEASE
""IMPOSSIBLE TO DEFEND.""
""WE HAVE IT ALL.""
""THE NAIL IN MANY COFFINS""
""NO FREE PASSES.""
""TOXIC TO THOSE CONNECTED.""
""BOOM.""
DALLAS GALWAY DMZ KOREA
THEY NEVER THOUGHT SHE WOULD LOSE
SPRING 2018 RELEASE",4,3,0,,,,
image_ (1984).jpg,"What's good present for a baby ghost? 
BOO-TEES!
punquotes.com",1,3,0,,,,
image_ (2832).jpg,"""When a cat closes its eyes around you it means it trusts you""
My cat:",7,2,0,,,,
image_ (2985).jpg,When you're happy Korea might become unified but you realize Kim Jong Un will find all the memes you made about him,6,4,1,,,,
image_ (447).jpg,"TRY TO LOOK ON MY OLD CODE
LOOKS TRASH",6,4,1,trash,my old code,274,209
image_ (15).jpg,When u ready to go out but uruber is taking forever,6,3,0,you,dog,None,None
image_ (257).jpg,I AM ONE WITH THE FISH,2,2,0,fish,cat,None,None
image_ (1812).jpg,"Fact 1406
Superhero_Fix
Including the extended cut, The Joker has 12 minutes of screen time, and only 50 lines of dialogue in Suicide Squad
Rate Jared Leto's Joker from 1-10. -thejoker justiceleague
superman batman dc",6,4,0,,,,
image_ (85).jpg,"i hope this one isn't toxic
cute boy",2,2,0,cute boy,apple,None,61
image_ (1516).jpg,THE WALL IS COMING,3,3,0,,,,
image_ (1101).jpg,YOU GOT ME RIBBONS!!OMG!OMG!!,7,2,0,,,,
image_ (1710).jpg,"HITLER HERE, HITLER THERE, HITLER LURKING EVERYWHERE!",7,3,1,,,,
image_ (1473).jpg,I WANTED GIORGIO ARMANI BUT HE GOT ME ARMANI EXCHANGE,4,2,0,,,,
image_ (203).jpg,"My doors is always open,but i shall never drag you through it.
My doors is always open for you but,I will never drag you inside.The door is my heart and inside is my life.",2,2,0,door,heart,126,220
image_ (2060).jpg,INDIANS WHO SCORED 300 AGAINST PAK,1,3,0,,,,
image_ (3027).jpg,"I want to feed her panda some bamboo.
If you know what I mean.",2,2,0,panda,ass,None,190
image_ (1263).jpg,"LOOK BOB-I DON'T CARE HOW YOU GET IT DONE
I EXPECT TO SEE 12000RP IN MY ACCOUNT NOW!",4,3,0,,,,
image_ (1213).jpg,"so y'all was crying over Leonardo DiCaprios oscar but this man been in 200 movies over 50 years and y'all was silent
Yoooo Word! This Man is a legend",2,2,0,legend,Jackie Chan,None,None
image_ (420).jpg,"Christmas Tree O Christmas Tree
Your ornaments are history",4,3,0,history,ornaments,None,None
image_ (3481).jpg,"I'LL BUILD A WALL
WITH FRICKIN' LASER BEAMS.",3,2,0,,,,
image_ (1867).jpg,"kim jong un the moment of un successful missle launch, 2017",6,4,0,,,,
image_ (3254).jpg,"LIAM NEESON IS OVERBOOKED
THEY PICKED THE WRONG PASSENER",3,4,1,,,,
image_ (2819).jpg,"IF YOU DO THE THINGS THAT ARE EASIER FIRST,THEN YOU CAN ACTUALLY MAKE A LOT OF PROGRESS.MARK ZUCKERBERG",7,2,0,,,,
image_ (3676).jpg,"WHEN SOMEONE ASKS WHY I'M STILL SINGLE
""I DON'T KNOW!I THOUGHT I WAS PRETTY AWESOME.""",4,2,0,,,,
image_ (2851).jpg,Leonardo Dicaprio and a prop from Critters.,5,3,0,,,,
image_ (3491).jpg,"THE DIFFERENCE BETWEEN YOU AND HITLER AT LEAST HITLER COULD USE AN OVEN.
Straight savage how dare you compare Hitler to them?",3,2,0,,,,
image_ (2698).jpg,"HAPPY BIRTHDAY LEO
YOU MAYBE A GREAT ACTOR WHO HAS WON AN OSCAR BUT FOR US YOU WILL ALWAYS BE THE TITANIC WALA GUY
Happy Birthday Leonardo
DiCaprio<3",1,2,0,,,,
image_ (197).jpg,"""LOVE IS AN OPEN DOOR""
CLOSE IT",6,2,0,door,love,126,None
image_ (3532).jpg,COLONIZE A QUARTER OF THE WORLD COMPLAIN ABOUT IMMIGRANTS,1,3,0,,,,
image_ (1348).jpg,"When you laugh at memes  to make yourself happy, but  they're all about being depressed",1,2,0,,,,
image_ (175).jpg,Alcohol is the anesthesia by which we endure the operation of life.,1,2,0,anesthesia,alcohol,None,None
image_ (229).jpg,"OH LOOK!!!
THE MAINE STATE FLOWER IS IN BLOOM.",6,1,0,flower,barricade,130,172
image_ (897).jpg,"Happy Birthday!
Rowan At... Oh Sorry.
Mr. Bean!",2,2,0,,,,
image_ (3090).jpg,"occupy democrats
INSTEAD OF SPENDING @20 BILLION ON HIS DUMB WALL
WHY DOESN'T TRUMP SPEND $20 BILLION ON HOUSING FOR HOMELESS VETERANS?",6,4,1,,,,
image_ (1504).jpg,CONTRACT ON ME FROM BABY GODFATHER SURVIVED,3,3,0,,,,
image_ (740).jpg,"when you eat a mint 
While wearing a mask.",2,3,0,you,eyes,None,191
image_ (1649).jpg,"TRUMP OR HILLARY?
TOP SOCKET OR BOTTOM SOCKET?",2,4,1,,,,
image_ (1472).jpg,TELETUBBLES?ALLENS!,2,1,0,aliens,Teletubbies,280,None
image_ (3825).jpg,SWEET!,1,3,0,,,,
image_ (3207).jpg,"""I feel like we should stop calling feminsts 'feminists' and just start calling people who are't feminist 'sexist.'
You are either a normal person or a sexist.""",2,2,0,,,,
image_ (454).jpg,COCAINE IS A HELL OF A DRUG,2,3,0,a hell of drug,cocaine,273,283
image_ (1647).jpg,"WHAT DO YOU SAY WHEN PEOPLE COMPARE BILL TO HARVEY WEINSTEIN?
""I SAY CLOSE BUT NO CIGAR""",1,3,0,,,,
image_ (2582).jpg,"so sad that Steve Jobs died of Ligma
who's steve jobs?
Ligma Balls",6,4,1,,,,
image_ (1446).jpg,"When your girlfriend is  silent during sex
Do the roar",3,2,0,,,,
image_ (1521).jpg,"WHAT YOU THINK YOU LOOK LIKE FLIRTING WITH YOUR CRUSH
WHAT YOU ACTUALLY LOOK LIKE",1,3,0,,,,
image_ (220).jpg,"When you finish a good movie on Netflix and see that there's a sequel
LIVE
BREAKING NEWS
Local potato happy today",1,2,0,you,tomato,None,59
image_ (3303).jpg,wtf jerry only has 4 fingers,1,3,0,,,,
image_ (3579).jpg,"MR BEAN AND TEDDY HAVE A FAR BETTER RELATIONSHIP
THAN TODAY'S COUPLES
Bean-Teddy!",2,3,0,,,,
image_ (3490).jpg,"This is Bill
Would you fuck Bill?
Bill would fuck Bill
Bill would fuck Bill Hard
Bill is smart
Be like Bill
Go fuck yourself",3,4,3,,,,
image_ (1633).jpg,"THE OSCAR GOES TO...
LA LA LA.. LA DE MOONLIGHT",1,3,0,,,,
image_ (610).jpg,The eyes are the windows of the soul,2,3,0,window,eyes,162,191
image_ (1718).jpg,AMERICAN HITLER COMING VERY SOON,3,4,1,,,,
image_ (1886).jpg,"HARRY + NIALL
VS
LIAM",2,3,0,,,,
image_ (1818).jpg,"THE MOMENT WHEN THE JOKER KNEW 
""PUDDIN!""
HE WAS GETTING LAID THAT NIGHT
""LET'S GO HOME.""
Finally catching up on Arrow.-NIghtwing",2,3,0,,,,
image_ (211).jpg,"Me hanging out with my closest friend
ANXIETY",4,2,0,friend,anxiety,None,None
image_ (1547).jpg,"I SEE YOU TRYING TO PUT ME ON THE FRIENDZONE
NOT ME B1TCH I GOT MEMES",1,2,0,,,,
image_ (1924).jpg,"""ALREADY HAVE AN ACCOUNT"" I HAVE NO MEMORY OF THIS PLACE",4,2,0,,,,
image_ (432).jpg,When someone calls you trash and you want to feel sad but deep down you know it's true,4,2,0,trash,you,274,None
image_ (2187).jpg,THE WORLD IS GONA MISS THIS GUY,1,2,0,,,,
image_ (3628).jpg,I love how all of these posters look really intense and then there's Deadpool,3,2,0,,,,
image_ (3524).jpg,"I'M CONFUSED
Which CP did you want?",7,2,0,,,,
image_ (2484).jpg,"SOMETIMES YOU SAY THINGS AND I JUST...
",3,3,0,,,,
image_ (75).jpg,"Teacher
Things she didn't explain during the lessons
Test",6,2,0,teacher;test,cat;food,None,46
image_ (3441).jpg,"Joe:Have you seen these memes about me?They love me!
Barack:No Joe,I have a country to run.
Joe:They're hilarious.",1,1,0,,,,
image_ (2550).jpg,"PICTURE GETS PUT UP AS EMPLOYEE OF THE MONTH
FOR A COMPANY THAT HE DOESN'T WORK FOR",6,4,1,,,,
image_ (1561).jpg,THE MOST USEFUL MAN IN WESTEROS,7,3,0,,,,
image_ (31).jpg,"I'M NOT A GUINEA PIG,I'M A CAR
I GO BOOM BOOM BOOM",1,3,0,car,guniea pig,105,None
image_ (2501).jpg,HARVEY SPECTER,2,3,0,,,,
image_ (1715).jpg,"Adolf Hitler giving a speech before invading Poland (September 1, 1939)
Heil Victory
",1,3,1,,,,
image_ (822).jpg,"STARTED FROM THE BOTTOM
NOW WE'RE HERE",2,3,0,,,,
image_ (847).jpg,"SANTA PUT ME ON THE NAUGHTY LIST
YOU PUT THAT FAT BASTARD ON THE HIT LIST
SHUT UP I DIDN'T PUT YOU
MOTHERFUCKING DUMBASS",3,4,1,,,,
image_ (2828).jpg,"LISTEN UP TO THE GODFATHER
YOU HAVE A HAPPY BIRTHDAY,RIGHT?",1,2,0,,,,
image_ (3444).jpg,"2000-putin wins
2008 and 2012-putin wins
2018-putin wins again",7,3,0,,,,
image_ (806).jpg,Fornite died in 10 months but Minecraft never died in 10 years,6,4,1,,,,
image_ (522).jpg,"Your sadness
Me doing my best to make you smile 2 meme at a time",2,3,0,your sadness;me,car;cat,None,105
image_ (216).jpg,,1,2,0,human,orange,None,57
image_ (1009).jpg,BIG BANG THEORY ILLUSTRATED,1,3,0,,,,
image_ (1110).jpg,"You know what?Girls don't like it when I start talking about science.
That's not specific to girls.",7,3,0,,,,
image_ (1283).jpg,When your grandma gets drunk,1,3,0,,,,
image_ (3463).jpg,"ANYHOW PORTIA KISS YOU AND HUG YOU
IS WAR WHEN YOU COME HOME?",3,2,0,,,,
image_ (99).jpg,"KNOWLEDGE IS POWER
WHEN I ANSWER A QUESTION RIGHT ON JEOPARDY,BECAUSE 
 IT WAS IN A BOOK I'M READING",1,5,0,power,knowledge,None,None
image_ (438).jpg,NAH THEY NEED TO HEAR THIS DESTINY 2 IS TRASH,6,4,1,trash,destiny,274,None
image_ (516).jpg,"FEMALE MOOD
IN ONE PICTURE",6,4,1,female mood,rainbow and thunder and lightning,None,134
image_ (3453).jpg,A FISH WITH HIS MOUTH CLOSED NEVER GETS CAUGH-TONY ACCARDO,4,3,0,,,,
image_ (2959).jpg,"When people say Spider-Man 3 is the worst Spiderman film, but the you show them The Amazing Spider-Man2
OH NO,THIS IS MUCH WORSE",6,4,1,,,,
image_ (3838).jpg,"Hey Hill,Whatchu doing?
Running the world.",6,3,0,,,,
image_ (2552).jpg,"""ARE YOU DOLPH ZIGGLER'S",4,3,0,,,,
image_ (20).jpg,"THEY SAID I COULD BE ANYTHING 
SO I BECAME A PANDA",1,3,0,panda,dog,None,None
image_ (508).jpg,"LOOK AT ME
YOU'RE MY DESSERT NOW",6,3,0,dessert,you,92,None
image_ (3182).jpg,"THIS LOOKS INTIMATE, SHOULD I LEAVE?
",6,4,0,,,,
image_ (2837).jpg,"WHY YOU NO DATE GAMER GUT?!
CHAD ONLY BREAK YOUR HEATER AND CHEAT ON YOU WITH LISA. YOU ARE TEARING ME APART STACY!!",3,2,0,,,,
image_ (3476).jpg,HI I AM LIAM!!!!,3,2,0,,,,
image_ (922).jpg,We review our ideas Thank you 2017,1,2,0,,,,
image_ (1803).jpg,"say you're a veteran who opposes the war and the current president and nobody bats an eye
say you're a veteran who hates troop worship and nationalism and everyone loses their minds",6,4,1,,,,
image_ (1542).jpg,"I DOWNVOTED THEM.I DOWNVOTED THEM ALL
AND NOT JUST THE SHITPOSTS,BUT THE HIGH-EFFORT MEMES,AND THE GIFS
I HATE THEM",3,2,1,,,,
image_ (1075).jpg,1 hour into my diet...,1,2,0,,,,
image_ (1494).jpg,NO NEW BABY GODFATHER MEMES DIES,4,3,0,,,,
image_ (3346).jpg,"""It's just a small get together.Dress casual.""
Me:",1,3,0,,,,
image_ (1065).jpg,WHEN YOUR CAT WATCHES TOO MUCH FOOD NETWORK,1,3,0,,,,
image_ (3717).jpg,"'IT'S HARD KILLING OFF SO MANY CHARACTERS.'
YOU'RE ADORABLE",1,2,0,,,,
image_ (2495).jpg,"HOW BADLY YOU WANT SOMETHING DICTATES 
HOUW HARD YOU WILL WORK AT IT",3,2,1,,,,
image_ (2398).jpg,"Ramesh
Suresh",1,3,1,,,,
image_ (1713).jpg,"""Hitler gives up on the war decides to play with his Wii!!!""",3,4,1,,,,
image_ (1161).jpg,I'm pretty sure the fish just jumped out of the water to be with him.,2,2,0,,,,
image_ (89).jpg,"My knowledge about math
My knowledge about Meryl Streep ",2,2,0,knowledge,book,None,119
image_ (791).jpg,TRYING TO SHOW HER YOU CARE,6,4,1,heart,wall,220,164
image_ (3393).jpg,"When you're level 1496 in Wii Sports boxing 
I'm something of a champion myself",3,2,0,,,,
image_ (776).jpg,CRY ME A RIVER,4,2,0,me,construction,None,168
image_ (3189).jpg,"When you are a feminist and somebody tries to insult you by telling you ""with these ideas no man will ever want to marry you""
YOU HAVE NO POWER HERE
",6,4,1,,,,
image_ (3223).jpg,Don't text me while i'm in the middle of texting you. Now i have to change my whole text.,3,2,0,,,,
image_ (1427).jpg,I HAVE A CF,1,3,0,head,hand,336,200
image_ (3234).jpg,"Couldn't we just lose our virginities again?
Because I think, actually, mine's growing back",2,2,0,,,,
image_ (2921).jpg,"Posting Anti-Feminist
memes on r/dankmemes
Posting Anti-Feminist memes on r/feminism",3,3,0,,,,
image_ (933).jpg,"Today I found out midgets don't like being called midgets-and they REALLY don't like being called ""people mcnuggets.""",6,4,1,,,,
image_ (862).jpg,"DOCUMENT HAS WRONG NAME?
WRONG NUMBER ON IT?
NOTHING PHOTOSHOP CAN'T FIX",2,3,0,,,,
image_ (2073).jpg,"Troll Bollywood Memes
CAN MODI NAME ANY COUNTRY IN THW WORLD WHR PPL HAVE DEPOSITED MONEY IN BANKS BUT CAN'T ACCESS IT?I HOPE PM WILL FIND PRACTICAL WAYS TO GIVE RELIEF TO THE COMMON PEOPLE
#ManmohanSingh",4,2,0,,,,
image_ (2533).jpg,"THAT MOMENT YOU REALIZE
PETER PARKER GETS PAID FOR TAKING SELFIES
THOR",6,4,1,,,,
image_ (808).jpg,"I did the Facebook 10 year challenge and it was not kind to me.
I went 10 years into the future instead of back.
Instant regrets.",4,3,0,frog,man,None,None
image_ (2475).jpg,"PUT SOME ICE ON IT
IF YOU DON'T HAVE ICE.USE A PUDDING POP.",1,3,0,,,,
image_ (3594).jpg,"LOVE IS IN THE AIR?
WRONG
NITROGEN,OXTGEN AND CARBON DIOXIDE ARE IN THE AIR",7,3,0,,,,
image_ (1448).jpg,"Me as a girIfriend  
why aren't you laughing at me?Everything I say is funny and adorable  
Basically",7,3,0,me,Pikachu,None,None
image_ (365).jpg,Yo why tf my turtle barking lmao,1,2,0,turtle,dog,None,None
image_ (3219).jpg,"HAVEN'T BEEN IN A WAR IN A WHILE 
LET'S JUMP INTO THIS ONE",1,1,0,,,,
image_ (3614).jpg,"THREW A GRENADE,KILLED 50 PEOPLE THEN IT EXPLODED",6,3,0,,,,
image_ (1200).jpg,"How you feel when you arrive at the horse show
How you feel when leaving the horse show",3,2,0,,,,
image_ (1534).jpg,Ghost on his way to Castle Black with Tormund and the rest of the wildings coz Jon has been a shitty dad to him.,4,3,0,,,,
image_ (1190).jpg,"OH YOU THOUGHT I WAS LISTENING
MAY I OFFER YOU ""WHITE CAKE?""",6,2,1,,,,
image_ (2000).jpg,If pooping is a call of nature. Does farting is a missed call?,1,3,0,call,poop,None,268
image_ (827).jpg,"THANOS GETS ALL INFINITY STONES AT THE END OF THE MOVIE AND
HALF THE PEOPLE ARE GONE FROM THE MOVIE THEATER. COINCIDENCE?",6,4,1,,,,
image_ (272).jpg,,4,3,0,monkey,orange,None,57
image_ (3651).jpg,COLLECT YOU PURPLE,1,3,0,,,,
image_ (3615).jpg,"CHUCK NORRIS DOESN'T SMOKE CIGARS
HE SMOKES,SMOKE GRENADES",1,3,0,,,,
image_ (364).jpg,"they told me i could be anything...
so I became a tank",1,3,0,tank,turtle,106,None
image_ (3436).jpg,"""Facebook was a mistake.""
-Mark Zuckerberg",4,2,0,mistake,facebook,None,None
image_ (2017).jpg,THIS IS WHAT MISOGYNY LOOKS LIKE,2,2,0,woman,miscogyny,None,None
image_ (1861).jpg,Rare image of Kim Jong il burning in hell,6,4,3,,,,
image_ (449).jpg,BRUH THIS DUDE IS TRASH,6,4,1,trash,dude,274,None
image_ (462).jpg,"COCAINE...
IS A HELL OF A DRUG",2,3,0,a hell of drug,cocaine,273,283
image_ (1864).jpg,"""HE WROTE ME BEAUTIFUL LETTERS. WE FELL IN LOVE.""
-DONALD TRUMP ON KIM JONG-UN",6,4,1,woman;man,Donald Trump;Kim Jong-un,None,None
image_ (3365).jpg,"AND THIS IS WHERE I PUT MY OSCAR
NOW THAT I HAVE ONE",1,4,1,,,,
image_ (2642).jpg,"""Offline is the new luxury. It should remain a basic human right to disconnect""",6,4,1,luxury,offline,None,None
image_ (2110).jpg,"I DON'T PUT YOU ON HOLD BECAUSE I HATE YOU
I PUT YOU ON HOLD BECAUSE I GET OFF 10 MINUTES.",3,2,0,,,,
image_ (2940).jpg,"Knowledge is power,and power corrupts
So study hard and he evil",7,3,0,power,knowledge,None,None
image_ (3897).jpg,"Marco, stop trying to confuse the people with FACTS.",6,4,0,,,,
image_ (2829).jpg,"I DON'T ALWAYS LAUNCH ROCKETS
BUT WHEN I DO THEY CRASH AFTER A MINTUE",4,2,0,,,,
image_ (3639).jpg,Leonardo DiCaprio accidentally cut his hand in the table scence in Djange Unchalned but remained in character.After the scence ended he receives app;ause from the crew.,3,3,0,,,,
image_ (2975).jpg,Me sneaking into the living room to play with my little cousin's toys while the rest of the family is eating dinner,2,3,0,,,,
image_ (2518).jpg,THIS ISN'T EVEN my final form,6,4,1,,,,
image_ (2198).jpg,THE BEST ECLIPSE EVER!,1,2,0,,,,
image_ (1353).jpg,When your mom yells at you in front of  your friends,4,2,0,you;your mom,dog;dog,None,None
image_ (3755).jpg,"THAT MOMENT...
WHENYOU FIND OUT THE JOKER & ROBIN WENT TO HIGH SCHOOL TOGETHER
Mother of God...you're right!! ~Crispy",2,3,0,,,,
image_ (3865).jpg,"RIGHT TO BEAR ARMS?
IN SOVIET RUSSIA. WE HAVE RIGHT TO WHOLE BEAR",2,2,0,,,,
image_ (1135).jpg,"MAKE ONE MORE SCUMBAG CHUCK NORRIS MEME I DARE YOU,I DOUBLE DARE YOU MOTHERFUCKER!",3,2,2,,,,
image_ (2844).jpg,"Gene Wilder
Gene Calmer
Gene Wilder dead at 83.",3,2,0,,,,
image_ (3355).jpg,"SO SHE HAS A BUNCH OF GUY FRIENDS...
SHES GECTTING QICKED DOWN AS WE SPEAK",1,4,0,,,,
image_ (1802).jpg,"I DON'T ALWAYS DRINK, BUT WHEN I DO, I BEAT HARLEY QUINN SENSELESS",1,3,0,,,,
image_ (3187).jpg,"""You ugly.""
""We're twins.""",6,3,0,,,,
image_ (1948).jpg,"STAY WEIRD
IT'S LEDAL AND FUN",7,2,0,,,,
image_ (2160).jpg,Who else hated this little cock sucking no titties bitch ass girl that tried to kill our nigga Nemo??,3,2,3,,,,
image_ (2920).jpg,"I JUST RAN OVER DONALD AND HILLARY
YOU'RE WELCOME",7,3,0,,,,
image_ (3221).jpg,"WHAT IF ALL THE KIM JONG UN MEMES
ARE ACTUALLY NEW US PROPAGANDA",1,4,1,,,,
image_ (2121).jpg,"remember when the bad luck brian meme lasted us from 2012-2015?remember in 2016 when we had one viral meme a month?remember last week when we had a viral spongebob meme an hour
Meme half-lives are getting shorter",7,3,0,,,,
image_ (164).jpg,"Honesty is a very expensive gift, Don't expect it from cheap people.",2,2,0,gift,honesty,251,None
image_ (3251).jpg,"PERSECUTES GAYS
ENTERS ANOTHER GOUNTRY THROUGH THE BACK DOOR",1,4,1,,,,
image_ (739).jpg,Me after having mint,1,3,0,me,monster,None,277
image_ (411).jpg,"Men   Life Goals
   VAGINAS
Do not fall for that shit. This is close to that anyway.",6,4,1,vaginas;life goals,pit;car and money and apartment,None,267
image_ (3450).jpg,"They copuldn't make her part of his world,so they made him part of hers",1,3,0,,,,
image_ (2362).jpg,"Who would have guessed that this:
Would grow up to be this?：",3,4,1,,,,
image_ (3726).jpg,"I'm Steve Harvey and you're watching Cartoon Network!
Lmao..incorrect! Clearly that's Nickelodeon",1,2,0,,,,
image_ (2040).jpg,"IS GAY
MISOGYNY!YOU JUST HATE WOMEN!",3,4,1,,,,
image_ (3894).jpg,HAPPY BIRTHIDAY SO HAPPY TO SEE YOU GROWING,2,2,0,,,,
image_ (1891).jpg,"IF YOU TAG POST NSFW AND ITS NOT NSFW, I WILL FIND YOU 
AND I WILL KILL YOU",3,2,0,,,,
image_ (2421).jpg,"I OCCASIONALLY
ENJOY COCAINE",1,2,0,cocaine,snow,283,148
image_ (2545).jpg,"when you're Spiderman and you get a job that requires you to get pictures of Spiderman
It's like printing my own money",1,2,0,,,,
image_ (2747).jpg,"ELSA...
DO YOU WANNA BUILD A WALL?",3,4,1,,,,
image_ (1721).jpg,"HITLER'S A JERK
HE BROKE OUR PINKY",4,4,0,,,,
image_ (2572).jpg,"EACH SPORT HAS IT'S GREATEST 
BUT HE WAS SPORTS' GREATEST
RIP MUHAMMAD ALI",2,3,1,,,,
image_ (535).jpg,"YOUR GIFT
IS IN THE LITTER BOX",6,3,0,Santa Claus,cat,None,None
image_ (2337).jpg,"What do you call a redneck bursting into flames?
A Fire Cracker!",6,4,1,fire cracker,redneck bursting into flames,234,None
image_ (379).jpg,"me
the hole in my heart sad cat memes
Kitty memes",4,2,0,me;hole in heart;sad cat memes,cat;cup;beer,None,123
image_ (687).jpg,,4,2,0,insomnia,sheep,None,None
image_ (439).jpg,WHEN YOUR MEMES ARE TRASH,4,3,0,trash,your memes,274,None
image_ (3352).jpg,"When the school shooter attempts to yell Hey Siri while you're hiding but you have an Android, and immmediately after yells Ok Google",1,3,0,,,,
image_ (3815).jpg,"WHAT IF I TOLD YOU
PARAMOUNT PURPOSELY MADE SONIG UGLY TO GAIN ATTENTION, AND HAS THE REDESIGH READY TO GO",3,1,0,,,,
image_ (1618).jpg,Stop doing this to your pics,6,1,1,,,,
image_ (563).jpg,"THE GOVERNMENT
YOU
IF YOU KNEW THE REAL MEANING BEHIND THE WORD GOVERNMENT, YOU'D WANT TO REBEL,OTHERWISE, ENJOY BEING A SLAVE",6,4,1,you;goverment,puppet;hand,None,200
image_ (2697).jpg,"DURING A DISASTER WE EVACUATE WOMEN AND CHILDREN FIRST
SO WE CAN THINK ABOUT A SOLUTION IN SILENCE",4,2,0,,,,
image_ (2700).jpg,i didn't know voldemort was in titanic,7,2,0,,,,
image_ (2677).jpg,"YOU KNOW WHAT REALLY GRINDS MY GEARS?
PEOPLE TRYING TO GET FREE KARMA WITH THE THIRD WORLD SUCCESS KID AFTER EVERY MAJOR SPORT CHAMPIONSHIP
Do we really have to do it every time?",5,2,0,,,,
image_ (1415).jpg,"YOUR CRAZY EX GIRLFRIEND KNOCKING ON YOUR DOOR BE LIKE...
I LOVE YOU.",4,4,1,ex girlfriend,woman,None,None
image_ (2062).jpg,"If traveling was free,you'd never see me again.
True story!",1,2,0,,,,
image_ (1667).jpg,"#WeekendAtHillarys#ClintonCollapse #HIllaryHealth #HillaryClinton
SHE'S FINE, JUST TAKING A LITTLE NAP",1,4,1,,,,
image_ (2270).jpg,"HOLD ON
ARE THOSE NACHOS",7,2,1,,,,
image_ (1377).jpg,"Me:  I need to stop being lonely  and talk to people  
Someone:  Hey  
Me:",5,2,0,me,cat,None,None
image_ (1673).jpg,"I don't remember seeing Hillary Clinton"" at ground zero on 9/11.-Rudy Giuliani at a Trump rally
Look to your left, Rudy.",7,3,0,,,,
image_ (318).jpg,"WHEN YOU'RE HOME ALONE IN THE SHOWER
AND YOU HEAR A NOISE",5,2,0,you,hippo,None,None
image_ (136).jpg,"MY LITTLE SISTERS
ME",3,2,0,little sisters;me,bird;woman,None,None
image_ (2276).jpg,THAT MOMENT YOU THINK ABOUT UPGRADING TO A RICHER OLD WHITE GUY,6,4,0,,,,
image_ (2067).jpg,TAMIZHISAI NOMINATED MODI FOR THIS PRESTIGIOUS AWARD!!CHECK REASON!!,7,4,1,,,,
image_ (3681).jpg,"when you tell everyone the story of how you fell in love with your girl,she be looking like",1,3,0,,,,
image_ (3543).jpg,"THE EPIC BATTLE BETWEEN GOOD AND EVIL IS BRIEFLY INTERRUPTED
BY THE SOUND OF A CAN OPENER....",2,3,0,,,,
image_ (316).jpg,"Spring allergies
Coronavirus
Seasonal flu",5,2,0,spring allergies;coronavirus;seasonal flu,Spider-Man;Spider-Man;Spider-Man,None,None
image_ (505).jpg,"NEW POTENTIAL CUSTOMERS
YOUR ORGANIZATION
YOUR LOYAL CUSTOMERS",6,4,1,organization;potential customers;loyal customers,man;woman;woman,None,None
image_ (2147).jpg,"SWIMMING WITH THE JELLIES
RIGHTEOUS,RIGHTEOUS!!",1,2,0,,,,
image_ (3573).jpg,"When I let a day go by without talking to you,that day it's just no good.
Loved this side of Barney. HIMYM ",4,2,0,,,,
image_ (3137).jpg,"THANK YOU BEING THE KIND OF FRIEND WHO WILL LAUGH
DURING THE EULOGY AT MY FUNERAL BECAUSE YOU THE THE REAL STORY",2,2,0,,,,
image_ (1751).jpg,"WHEN MY FRIENDS ASK ME MY FAVORITE DISNEY QUOTE
""HEIL HITLER""- DONALD DUCK 1943 
",2,3,0,,,,
image_ (1170).jpg,"ZOMBIE APOCALYPSE HIT DURING PHISH TOUR

STILL KNOWS WHERE TO SCORE WEED",2,2,0,,,,
image_ (1586).jpg,"mom: bethany please stop practicing.. it's 2am
me: FINE--
I'll be in my bedroom, making no noise and pretending that l don't exist.
",2,2,0,,,,
image_ (1136).jpg,"WHEN THE HULK GETS REALLY ANGRY HE TURNS INTO CHUCK NORRIS 13:46
100 Most Hilarious Chuck Norris Memes Ever",2,3,0,,,,
image_ (1395).jpg,When you're looking in the comments  section for memes but it's just people  tagging their shitty friends,6,2,1,,,,
image_ (1374).jpg,That one friend who snaps everything,6,2,0,,,,
image_ (3805).jpg,WHEN ITS VALENTINES DAY AND YOU HAVE MISOGYNY,4,2,0,,,,
image_ (1698).jpg,"WAHT'S THE DIFFERENCE BETWEEN HILLARY AND PUTIN?
PUTIN CAN WIN AN ELECTION RIGGED IN HIS FAVOR",1,3,0,,,,
image_ (3520).jpg,"Meer:Acts pissed at sexist meme
Inner Meer:cheered up but won't dive pud satisfaction",2,3,0,,,,
image_ (2873).jpg,"my crystal ball is telling me that ur a faggot
Hatsie",1,2,0,,,,
image_ (2626).jpg,"I WON'T BE IMPRESSED BY TECHNOLOGY UNTIL THE DAY_
I CAN CLOSE THE YOUTUBE APP BUT THE MUSIC CONTINUES PLAYING",6,4,0,,,,
image_ (472).jpg,Patience is one of life's hardest lessons.,2,2,0,lesson,patience,None,None
image_ (3616).jpg,"CHUCK NORRIS ONCE BUILT A PRINTER
IT HAS NEVER JAMMED",2,3,0,,,,
image_ (3769).jpg,"All I wanna know is what happened between them like...nick said zayn is a trigger for harry,zayn and Liam admitted zarryweren't close..
IM CONFUSED",4,2,0,,,,
image_ (1130).jpg,WON THE WORLD SERIES OF POKER USING POKEMON CARDS,1,3,0,,,,
image_ (400).jpg,"COCAINE!!!
SO MUCH COCAINE!!!",7,2,0,cocaine,snow,283,148
image_ (351).jpg,"me
last pringle in the pringles can",3,2,0,me;pringle,woman;man,70,None
image_ (2199).jpg,"15 OF THE 19 9/11 HIJACKERS WERE ILLEGAL IMMIGRANTS
IF THEY WERE SITTING IN JAIL AWAITING DEPORTATION TODAY,OBAMA WOULD HAVE SET FREE AND BLAMED THE SEQUESTER.",4,3,0,,,,
image_ (88).jpg,"*studies for 2 minutes*
Knowledge is Power",2,2,0,power,knowledge,None,None
image_ (412).jpg,"Me  Life Goals
My Future
Where I'm headed",6,4,1,future;life goals,pit;car and money and apartment,None,267
image_ (96).jpg,"my knowledge of serial killers
my knowledge of math",2,2,0,knowledge,book,None,119
image_ (976).jpg,"I Worte All Plays On My Wristband 
IT DIDN'T HELP",4,2,0,,,,
image_ (918).jpg,WHEN YOU DANCE LIKE GOD,2,3,0,,,,
image_ (3541).jpg,"WHAT DO YOU MEAN
THE GAS BILLS ARE HIGH?",7,4,0,,,,
image_ (1496).jpg,"HAPPY BIRTHDAY GODFATHER!LEAVE THE GUN,TAKE THE CAKE",4,3,0,,,,
image_ (2020).jpg,"When your daughter's boyfriend Picks her up for their date Throw a shot gun shell at him
Then tell him it Moves A lot faster after 10pm",3,2,0,,,,
image_ (3494).jpg,"Chuck Norris died 20 years ago,Death just hasn;t built up the courage to tell him yet.",3,3,0,,,,
image_ (1833).jpg,"KIM JONG UN SAYS HES GONNA NUKE THE US 
HA, UR SO FUNNY KIM",6,4,1,,,,
image_ (3350).jpg,"A lie is a great story 
That somebody ruined 
With the truth
Barney Stinson",3,2,0,story,lie,none,none
image_ (2910).jpg,"She:""I don't like FRIENDS'
me:
Would you rather drown or be burned alive?",1,2,0,,,,
image_ (1436).jpg,"Girlfriend:  * acts annoying 
 Boyfriend:  * gets annoyed* 
Girlfriend：
True story",7,3,0,girlfriend,Pikachu,None,None
image_ (3464).jpg,MEANWHILE AT FOSTERS HOME FOR IMAGINARY FRIENDS,2,3,0,,,,
image_ (3991).jpg,"Mr. Bean taught me one thing in life.
Enjoy your own company instead of expecting someone else to make you happy.",2,3,0,,,,
image_ (3875).jpg,"THERE ARE LIMITS
self hating Joke here",4,2,0,,,,
image_ (3723).jpg,Getting home after working a 49.5 hour shift working Hurricane Harvey,1,2,0,,,,
