file_name,text,sentiment,intention,offensiveness,source_text,target_text,source_id,target_id
image_ (660).jpg,"This is a weed smokers lungs after he died from marijuana. Maybe next time you'll think before taking that hit
",6,2,0,lung,orange,189,57
image_ (619).jpg,"I'm your hope, You're my hope, I'm J-Hope",2,2,0,hope;hope,i;you,None,None
image_ (2753).jpg,"When you login to your neighbors router using ""1234""
The Expert",5,3,0,you,man,None,None
image_ (2355).jpg,"WHAT'S BLACK ON TOP AND WHITE ON BOTTOM
RAPE",3,4,1,,,,
image_ (1814).jpg,"Hell hath no fury like me when I'm a little inconvenienced and hungry
fridays hungry mood smh petty ugh joker memes wtf fml",3,2,0,,,,
image_ (605).jpg,Wolves in Sheeps Clothing,6,4,1,sheep,wolf,None,None
image_ (3840).jpg,Penguin is Anguin,3,3,0,,,,
image_ (1631).jpg,"CONGRATS MICHIGAN STATE 
COTTON BOWL CHAMPIONS",2,1,1,,,,
image_ (1366).jpg,u ever sit down n think about ur friends n  how much they have impacted ur life and  how much they mean to u and u just...,1,3,0,,,,
image_ (1098).jpg,NEXT TIME THEY WILL BUY FOODS THAT I LIKE,3,3,0,,,,
image_ (1133).jpg,"When Chuck Norris does a push up,he isn't lifting himself up,he's pushing the Earth down.",2,3,0,,,,
image_ (541).jpg,"Hide and Seek
CHAMPION!",2,3,0,cat,doll,None,236
image_ (169).jpg,"""Life is a sexually transmitted disease""",6,4,1,transmitted disease,life,None,None
image_ (3139).jpg,"I think everybody should get rich and famous and do everything they ever dreamed of so they can see that it's not the answer.
-Jim Carrey
",2,2,0,,,,
image_ (3186).jpg,WHEN SOMEONE YOU HATE SAYS SOMETHING FUNNY,6,4,1,,,,
image_ (2492).jpg,"""YOU'D BE SURPRISED WHAT PEOPLE YOU TRUST WOULD DO WHEN SOMEONE PUTS THEM IN A POSITION WHERE 
THEY THINK THEY DON'T HAVE A CHOICE.",2,2,0,,,,
image_ (135).jpg,"Meoo...I
mean...
Shit,what language these fuckers speak",4,2,0,rabbit,cat,None,None
image_ (937).jpg,"MAINSTREAM METAL SALES
METAL TRENCHES",1,3,0,mainstream metal sales,house,None,166
image_ (1529).jpg,"This is Bran
Bran's seen Game Of Thrones Doesn't spoil it for others
Be Like Bran",2,3,0,,,,
image_ (357).jpg,"Apple watch
15 Apple Memes For All The iHaters-Memebose-Funny Memes",1,4,1,watch,apple,224,61
image_ (458).jpg,"Y'ALL GOT ANYMORE OF THAT WUHAN VIRUS MONEY?
I LIKE GETTING FREE MONEY
FREE MONEY IS A HELLUVA DRUG",6,4,3,a hell of drug,free money,273,267
image_ (638).jpg,,3,3,0,policeman,cat,None,None
image_ (3550).jpg,"TEUMP KISSES KIM
Did Donald Trump and Kim Jong-Un just kiss?Umm,kinda.",2,4,1,,,,
image_ (3832).jpg,i am pedobama,1,2,0,,,,
image_ (1492).jpg,JUST WHEN I THOUGHT I WAS OUT THEY PULL ME BACK IN!,3,2,0,,,,
image_ (2140).jpg,"WHEN YOU REALISE THE TURTLE
SMOKES WEED",7,2,0,,,,
image_ (3854).jpg,"HOW IN THE HELL...
DIDI ENGINEERS OF THE FUTURE..FORGET SEATBELTS AND AIRBAGS?",7,3,1,,,,
image_ (3535).jpg,Tom annd jerry had the realest beef of all time...never said a word..It was just on sight,3,3,0,,,,
image_ (2183).jpg,"Grant me a visa and mi tell u what Portia an Barack doing...
I trust my husband..
Yes but u ever hear bout a place name ""back road""or a dance name""puppy tail""???
How much visa u need???",7,2,0,,,,
image_ (3291).jpg,"CAN WE ALL TAKE A MOMENT TO REALIZE THAT THE FOURTH HAPPY POTTER MOVIE WAS
THE DOCTOR TRYING TO END TWILIGHT BEFORE IT STARTED ",3,4,0,,,,
image_ (1752).jpg,"When you get a blood transfusion from Adolf Hitler and get the sudden urge to throw your little brother in the oven 
A part of him lives within me, doesn't it 
Preheat to 450",6,4,1,,,,
image_ (2732).jpg,"I AM NOT SLEEPING.
JUST RESTING MY EYES.",2,3,0,,,,
image_ (928).jpg,"MR MIME: THE BARRIER POKEMON. KNOWN TO MAKE WALLS AND HAVE SILLY HAIR
THAT'S MY POKEMON",3,4,1,,,,
image_ (3889).jpg,What is Bill looking at?,7,1,0,,,,
image_ (3702).jpg,"THE DAY YOU START YOUR NEW JOB
THE DAY YOU QUIT",1,3,0,,,,
image_ (3847).jpg,"they always say ""weird flex but okay"" but never ""weird flex, are you okay?""",4,3,0,,,,
image_ (1930).jpg,AND MY BOW,4,2,0,,,,
image_ (2194).jpg,"""Lork give us the strength not to put hands on Trump and Melania.""
#GeorgeHWBushFuneral
12:07 PM `05 Dec 18`",4,2,0,,,,
image_ (861).jpg,"I HAVE ONE RULE
NEW IS ALWAYS BETTER... ALWAYS",1,2,0,,,,
image_ (1443).jpg,"I RAN INTO YOUR  
EX  
WITH MY CAR",3,1,0,,,,
image_ (3690).jpg,"Using overused animation formats
Using explored ""The Godfather"" format
The format you can't refuse",3,2,0,,,,
image_ (896).jpg,"-EXPECT LEAST FROM OTHERS
-ENJOY YOUR OWN COMPANY
THANKS ALOT MR. BEAN!!!
FOR TEACHING US THESE IMPORTANT LIFE LESSONS...
Thank You Mr. Bean..:)",2,2,0,,,,
image_ (3001).jpg,"Seal Team 6 moments before the assassination of Osama Bin Laden

memes Seal Team Six",6,4,1,,,,
image_ (3212).jpg,HARD WORK IS THE KEY TO SUCCESS BUT SO IS SMART WORK,2,2,0,key;key,hard work;smart work,110,None
image_ (3091).jpg,Biden definitely shows people wallet photos of Obama,6,4,1,,,,
image_ (3828).jpg,Finding EMO,2,3,0,,,,
image_ (613).jpg,FOR YOU,1,1,0,love,rose,None,128
image_ (1168).jpg,"OUTLAW COUNTRY?

TELL ME MORE ABOUT THIS NEW FAD",2,1,0,,,,
image_ (773).jpg,"In union there is strength.
-Aesop",2,3,0,strength,union,None,None
image_ (2555).jpg,"DON'T THROW THAT BALL TO ME
I JUST GOT MY NAILS DID",6,4,1,,,,
image_ (1943).jpg,Sorry i can't today.My sister's friends mother's grandpa's brother's grandson's uncle's fish died and yes it was tragic!,4,3,0,,,,
image_ (2773).jpg,15 min in midnight showing of X-Men:Days of Future Past,4,3,0,,,,
image_ (3412).jpg,"What kind of haircut tthat called
Default texture",3,3,0,,,,
image_ (2713).jpg,"The dart that bounced off the wall  
Me
My nerf gun",1,3,0,me;nerf gun;dart,cat;tail;telescope,None,None
image_ (2727).jpg,"When you trying to Netflix and chill but she starts undressing
THE DOOR IS THIS WAY",1,3,0,,,,
image_ (3674).jpg,"CRAZY EX-GRILFRIEND GOT ARRESTED
TODAY IS A GOOD DAY",3,4,1,,,,
image_ (693).jpg,,1,3,0,head,strawberry,336,55
image_ (927).jpg,"DIFFERENT BRAINS
EXPLORING DIFFERENT BRAINS WITH HACKIE REITMAN,M.D.
AUTISM&EMPLOYMENT with Dr.Temple Grandin",1,3,0,,,,
image_ (3879).jpg,"Rahul Gandhi after his speech
YOU CANNOT BE SERIOUS
People after Rahul Gandhi's speech",7,3,0,,,,
image_ (3106).jpg,this is what neighborhood cats look like in Texas,2,3,0,,,,
image_ (2684).jpg,"TITANIC BE LIKE
I NOMINATE ALL PASSENGERS FOR THE ICE BUCKET CHANLLENGE",2,2,0,,,,
image_ (2782).jpg,"""BE CAREFUL,YOU'VE ONLY GOT ONE""MESSAGE INSIDE A ZIPPER",2,2,0,,,,
image_ (3132).jpg,President Dr. Evil Trump a Deepfake,6,4,1,,,,
image_ (213).jpg,"my friends watching a movie i liked 
me making sure they're laughing",6,2,0,me;friends,man;woman,None,None
image_ (205).jpg,"A GRATEFUL HEART 
WILL OPEN DOORS TO BEAUTIFUL BLESSINGS",2,2,0,door,heart,126,220
image_ (2842).jpg,I asked only that you sell me your information and obediently follow my word.,1,4,0,,,,
image_ (3697).jpg,"MY FACE WHEN
SOMEONE TELLS ME THEY DONT HAVE THE TIME TO WATCH GOT",3,3,0,,,,
image_ (1817).jpg,"SOME ENEMIES LOSE THE FIGHT 
BUT WIN THE FANS",2,3,0,,,,
image_ (3778).jpg,If a lizzard wore pants would he wear them like this or like this?,1,3,0,,,,
image_ (1572).jpg,"Anything but Slotherine
Hitler hated this site too",4,4,0,,,,
image_ (2840).jpg,"SEXISM
ALWAYS ASSUMING THE ANTICHRIST WILL BE A MAN
Damn racist sexist, sexist racists!--Check out Our 2nd",6,4,1,,,,
image_ (2772).jpg,KEEP CALM AND BRING SOME BEERS,3,3,0,,,,
image_ (1215).jpg,Leonardo DiCaprio from  the 90s,2,2,0,,,,
image_ (801).jpg,NICOLAS CAGE IS OUR NATIONAL TREASURE,2,3,0,treasure,Nicolas Cage,None,None
image_ (2494).jpg,"GET YOUR SHIT TOGETHER.
Hary Specter
SUITS",3,2,2,,,,
image_ (3430).jpg,SOMETIMES EVEN I AM AFRAID OF THE THINGS MY MIND COMES UP WITH.,4,2,0,,,,
image_ (2209).jpg,"LOOKS AT SOCIALLY AWKWARD PENGUIN MEMES
FEELS GOOD ABOUT SELF",1,2,0,,,,
image_ (2813).jpg,Memes die so fast because people spam them so fucking much to the point where every post is the same meme,1,3,0,,,,
image_ (3007).jpg,Feminist picnic falls apart after no-one makes any sandwiches,6,4,1,,,,
image_ (3323).jpg,"NOW IF EVERYONE COULD STOP TO TELL ME TO BE LIKE BILL
THAT WOULD BE GREAT",3,4,1,,,,
image_ (2471).jpg,"WOMEN ON TINDER WRITE:""GUYS OVER 6 FEET ONLY""AND NO ONE BATS AN EYE
I WRITE:""GIRLS OVER DOUBLE D ONLY""AND EVERYON LOSES THEIR MINDS",3,4,1,,,,
image_ (2069).jpg,"THAT'S NOT
HOW SCIENCE WORKS",3,2,2,,,,
image_ (2876).jpg,"BEING MEAN TO THE QB
15 YARD PENALTY",3,2,0,,,,
image_ (2733).jpg,"When old controversies are dying down and internet is clam
Trump:",3,4,2,Trump,cat,None,None
image_ (67).jpg,"I FUCKING LOVE
COCAINE
Image-670889]|Cocaine Bear|Know Your Meme",1,2,0,cocaine,snow,283,148
image_ (3876).jpg,NEVER TRUST SOMEONE YOU CAN BLINDFOLD WITH A SHOELACE,1,1,1,,,,
image_ (2284).jpg,WHEN YOU WANT TO GO HIKING BUT SLAV SQUAT IS LIFE,6,4,0,life,slav squat,None,None
image_ (3142).jpg,I'M NOT A SMART MAN BUT I KNOW THAT HIP HOP DOESN'T BELONG IN COUNTRY MUSIC,2,2,0,,,,
image_ (1899).jpg,"GIRLFRIEND 
POCKET DIALS YOU LISTEN CAREFULLY
TO EVERYTHING",6,4,0,,,,
image_ (3985).jpg,Kobe Mr. Bean Bryant! Credit: BasketballPics,1,3,0,Kobe,Mr.Bean,None,None
image_ (856).jpg,"BARNEY STINSON'S TOTALLY AWESOME HARRY POTTER PICK UP LINES
HAVE YOU HEARD OF PLATFORM 9 AND 3/4? WELL, I CAN THINK OF SOMETHING ELSE WITH THE EXACT SAME MEASUREMENTS...",1,3,0,,,,
image_ (1582).jpg,"You wanna do something fun?Wanna go to Honeydukes?
I CANT GO TO HONEYDUKES IM' ON A NO-SUGAR DIET
GOD HERMIONE YOU'RE SO STUPID!",2,1,0,,,,
image_ (1344).jpg,"CAN'T BE BETRAYED  
IF YOU HAVE NO FRIENDS",4,2,0,,,,
image_ (3945).jpg,"Keep calm and think ""What would Harvey Specter do?""
whisper",2,1,0,,,,
image_ (125).jpg,"WHAT IF I TOLD YOU
YOU'RE RUBBISH",3,4,3,rubbish,you,274,None
image_ (195).jpg,"KAREN WITH HER ESSENTIAL OILS
I don't fear you.
CORONA VIRUS
Then you will die brave than most.
Can't argue with that",4,2,0,CORONA;KAREN with her essential oils,man;man,None,None
image_ (442).jpg,me looking into my brain,6,4,1,trash,my brain,274,198
image_ (3401).jpg,"I'M THE KING OF THE WORLD
AAAAAH
WOOOOOOOOOOOO",3,2,0,,,,
image_ (253).jpg,,4,4,2,Donald Trump,frog,None,None
image_ (2678).jpg,"YOU'RE TELLING ME YOU BUY WATER
BECAUSE IT'S DOING TO RAIN TOO MUCH?
",7,2,0,,,,
image_ (1142).jpg,Chuck Norris doesn't have an ESC key on his computer,3,2,0,,,,
image_ (2047).jpg,OMG OMG.Modi hide bomb in my home and now planning to press the remote anytime,6,4,1,,,,
image_ (3239).jpg,"sometimes i wonder
what did my human do to deserve me?",2,2,0,,,,
image_ (2592).jpg,"Gets forced out of Apple.
5 mins later, gets invited back.
AWESOME, BRO, WATCHING THIS MOVIE IS...
FASTER THAN BROWSING THROUGH WIKIPEDIA",6,4,1,,,,
image_ (3760).jpg,RESPECT MY AUTHORITSN!,4,4,1,,,,
image_ (2367).jpg,"I'M SICK OF POLITICS
So,HERE'S A PICTURE OF MICHELLE OBAMA RIDING A UNICORM",3,4,1,Michelle Obama;unicorn,orangutan;horse,None,None
image_ (3181).jpg,"WHY DON'T YOU HAVE A SEAT
AND EXPLAIN TO ME WHY I FOUND THESE PICTURES OF MYSELF ON THE INTERNET",3,2,0,,,,
image_ (903).jpg,"""Where did all your money go?""
Weed...",4,2,0,weed,money,146,267
image_ (2997).jpg,"I'M GONNA BUILD SOME FANCY WALLS 
EVEN THOUGH I HAVE MILLIONS OF EXTRA DOLLARS IN GONNA MAKE THE MEXICANS PAY FOR IT",6,4,1,,,,
image_ (1470).jpg,"ALIENS?GOOD LUCK,COMMANDER",2,3,0,,,,
image_ (3727).jpg,"And,lo,Jesus fed the needy only after receiving a massive public shaming on Twitter.",4,3,0,,,,
image_ (1191).jpg,"Jeremy Kaplowitz/July 11,2017/Hard Drive
Climate Scientists Warn That All Super Mario Levels Will Be Underwater by 2025

Before the
F.L.U.D.D. 
Paris pour le climat",1,3,0,,,,
image_ (2437).jpg,"Me,forcing this seal meme
7 upvotes
My better judgment",3,4,1,me;7 upvotes;my better judgment,sea lion;sea lion;sea lion,None,None
image_ (844).jpg,"JACK AND JILL ON MY FUTURE
MAKE IT LOOK LIKE AN ACCIDENT.
YOU FIND THIS""TOOTH FAIRY""
AND BRING HER TO ME
GIRL TOOK MY JUICEBOX?
PUT MY LITTLE PONY HEAD IN HER CRIB
EVERYTIME IA ALMOST GOT HIS RAT ASS
HE SAYS PEEKABOO AND THE BASTARD'S GONE.
",3,4,1,,,,
image_ (3222).jpg,"PEOPLE COMPLAIN THAT I KEEP QUOTING LINKIN PARK
BUT IN THE END IT DOESN'T EVEN MATTER",2,3,0,,,,
image_ (2950).jpg,"When Deadpool first met Spider-Man, he said he was Spidey from the future. Spider-Man cried.",4,3,0,,,,
image_ (703).jpg,Making the most of the snow...,1,3,0,fire,snow,159,148
image_ (1391).jpg,"WE ALL HAVE ONE FRIEND WHO  
MAKES SEXUAL INNUENDOS OUT  
OF EVERYTHING YOU SAY",1,3,0,,,,
image_ (1760).jpg,NO ONE CARES,6,3,0,,,,
image_ (3498).jpg,"LUCIFER FOR PRESIDENT 
THIS COUNTRY IS GOING TO HELL ANY WAYS,WHY NOT ELECT SOMEONE WHO KNOWS THE PLACE?",3,2,0,,,,
image_ (2369).jpg,"I'VE NEVER BEEN MORE ASHAMED
TO BE A REDDITOR",3,2,0,,,,
image_ (2224).jpg,"DON'T HAVE ANY IDEA
ABOUT YOUR BIRTHDAY",4,2,0,,,,
image_ (1002).jpg,"We can change.
Or we could walk right behind each other and look like one person going really fast.",4,3,0,,,,
image_ (1580).jpg,Not having a mother does not mean you can always wear the same shirt,3,4,0,,,,
image_ (956).jpg,"This is Bill.
Bill likes playing games on Facebook.
Bill knows his friends don't play.
Bill doesn;t send them annoying requests.
Bill is smart.
Be like Bill.
CANDY CRUSH",2,1,0,,,,
image_ (1866).jpg,"When Kim Jong-un finally sees all those ""fat kid"" memes you been posting on 4chan",6,4,1,fat kid memes;Kim Jong-un,cloud;Sad Frog,None,157
image_ (2282).jpg,"POST UNPATRIOTIC PUTIN MEMES ALL DAY AND NOBODY CARES
GET SCALPED ON THE MINIMUM WAGE AND EVERYONE LOSES THEIR MIND",3,2,0,,,,
image_ (323).jpg,"What do Donald Trump and a Pumpkin have in Common?
They're Orange on the outside, Hollow on the Inside and should be tossed out in early November.",6,4,3,pumpkin,Donald Trump,66,None
image_ (1879).jpg,HEY VICKY YOU NEED A NEW IPHONE!,1,1,0,,,,
image_ (1357).jpg,When you hear someone  opens bag of chips,7,3,0,you,dog,None,None
image_ (1749).jpg,"""Unfortunately, your sbumi-""
SHUT UP, HITLER.
We live in a society",4,4,1,,,,
image_ (174).jpg,trying to change a logo without offending anybody,5,2,0,offence,green line,None,None
image_ (3420).jpg,"I'VE DECIDED I'M NOT OLD.
I'M 25,PLUS SHIPPING AND HANDLING!",1,2,0,,,,
image_ (2827).jpg,"Yeah,like the guy wearing this $4000 suit is going to make you a mouse with two buttons
COME ON",1,4,1,,,,
image_ (0).jpg,"That moment after you throw up and your friend asks you ""YOU GOOD BRO?"" I'M FUCKIN LIT
",4,4,1,you,seal,None,None
image_ (2338).jpg,"Sen. Diane Feinstein Said This in 1994 and Democrats CHEERED
Trump Says it in 2017
And He's a Racist?
Democratic Senator Diane Feinstein sounded a lot like Trump in 1994 on the issue of immigration.",6,4,1,,,,
image_ (3776).jpg,"I prefer chicken
Cheep!
I SAID,REAL CHICKEN
PERFECTION",3,2,0,,,,
image_ (849).jpg,"To Be Continued
TRIGGERED
BABY GODFATHER CHALLENGE
*GONE WRONG*
*GOT BEATEN BY MAFIA*
An interesting Squid
",2,3,0,,,,
image_ (3326).jpg,My girlfriend's hairclip nearly put me in cardiac arres...,3,2,0,crab,hairclip,None,243
image_ (388).jpg,"COCAINE.
SO MUCH COCAINE.",7,3,0,cocaine,snow,283,148
image_ (2397).jpg,"Rahul Gandhi's name proposed for Guinness World Record for losing 27 elections
Proud moment for Gongress",1,4,1,,,,
image_ (2350).jpg,"Calling the kettle""black""
here's a non-racist meme with the word""black""in it,you wouldn't read about it",3,4,1,,,,
image_ (2050).jpg,"JUDGE ME BY MY WORK
I JUST DID",3,2,0,,,,
image_ (632).jpg,POLICE,3,4,1,policeman,cat,None,None
image_ (811).jpg,"NO SPOILERS FOR AVENGERS INFINITY WAR!
THANOS DEMANDS YOUR SILENCE",6,4,1,,,,
image_ (1222).jpg,Doesn't look like they're keeping whatever expensive thing they bought together.,3,3,0,,,,
image_ (3362).jpg,me:*jokes about rape and suicide kids on the schook bus i drive:,3,2,0,,,,
image_ (828).jpg,"ENTER THE ASS
HELP! I'VE FALLEN
AND I CAN'T BE AVENGED",4,1,1,,,,
image_ (2970).jpg,"IF YOU WANT TO EXPOSE FAKE FRIENDS AND HATERS
START EXPOSING YOUR BLESSINGS AND FAVOR AND SEE WHO CLASPS FOR YOU
ITZ ALL LOVE",6,4,1,,,,
image_ (1062).jpg,YES I AM JUDGING YOU,6,2,0,,,,
image_ (1363).jpg,"When your best friend  posts"" have no one""  
Me: 
What am I then? A potato???",7,2,0,,,,
image_ (2956).jpg,"Heard you were fucked by Ramsey?
Glad, he wasn't my new nephew
",6,4,1,,,,
image_ (3449).jpg,BEST NEW CHARACTER,2,3,0,,,,
image_ (558).jpg,"AH HA!
I GOT THIS!
",1,3,0,idea,light bulb,None,127
image_ (1627).jpg,when the debate memes are funny but then u remember this is the state of our country rn,4,2,0,,,,
image_ (3729).jpg,JOKER'S MOST EVIL SCHEME YET:FUCKED UP FANFICS.,1,3,0,,,,
image_ (1714).jpg,Adolf Hitler gives his last speech as the Russians close in on Berlin(March 1945 colorized),1,3,0,,,,
image_ (2771).jpg,THIS NEW X-MEN MOVIE LOOKS DOPE BUT WHO'S DONNA BE THE VILLAIN?,1,3,0,,,,
image_ (2805).jpg,"""I have no muscles. Millions of ants live under my dermis. Because of this, cats are afraid of me. Dogs are afraid of me but not because of the ants.""
-Mark Zuckerberg,2017",7,2,0,,,,
image_ (539).jpg,How your girl looks when she's about to ask for something,2,3,0,your girl,cat,None,None
image_ (49).jpg,"People who won't updata my King fu panda memes
Me
The 3 people 
Today's 17+Most Hilarious Memes-Skadoosh-(Read it)Surf Funny",1,2,0,me,panda,None,None
image_ (1358).jpg,"WHEN YOUR HAVING FUN WITH  
VOUR COUSINS  
AND YOUR MOM SAYS GET READY  
WE I FAVING IN 30 MINUTES",4,2,0,,,,
image_ (1016).jpg,Old times!bigbangtheory,1,3,0,,,,
image_ (1808).jpg,"LSD 
COCAINE
WANNA KNOW HOW I GOT THESE SCARS?
HEROINE 
METH",6,3,0,,,,
image_ (133).jpg,"SOME PEOPLE IN THE MORNINGS
ME",4,2,0,some people;me,leopard;rabbit,None,None
image_ (2184).jpg,YES THIS IS PRESIDENT OBAMA,6,3,0,,,,
image_ (631).jpg,The doctor said I need to eat more fish...,4,3,0,fish,meat,None,316
image_ (371).jpg,whta kind of turtle is this,1,2,0,turtle,dog,None,None
image_ (934).jpg,"When You Steal Moms Visa For V-Bucks
-I hope mom and dad don't find out",1,3,0,,,,
image_ (3546).jpg,"DON'T BE FOOLED BY THE KINGHTHOOD I GOT
I'M STILL DAVOS FROM THE BLOCK",3,2,0,,,,
image_ (771).jpg,"In Union
There Is Strength",2,3,0,strength,union,None,None
image_ (2854).jpg,"COWBOYS FANS BRAG ABOUT THEIR SUPER BOWLS
BUT DON'T HAVE TECHNOLOGY TO WATCH THEM",2,2,0,,,,
image_ (961).jpg,"This is Bill
Bill is a developer
Bill doesn't fuck up the stackoverflow.com
Bill has a bath everyday
Bill is smart
Be like Bill",2,1,0,,,,
image_ (2831).jpg,"Barney high as fuck,
thinking hes can read alien's
minds and shit.",2,4,1,,,,
image_ (2404).jpg,"I ACCIDENTALLY UESD A SWEAR WORD
AND L KNOW MY MOM HEARD IT",5,3,0,i,seal,None,None
image_ (3658).jpg,shout out to all the feminist meme admins out there for ensuring ill never be able to comfortably talk to women in public ever again,1,3,0,,,,
image_ (3568).jpg,"THE BRIDE GOT COLD FEET?
THIS SHIT IS GOING DOWN WHETHER YOU LIKE IT OR NOT",4,3,0,,,,
image_ (81).jpg,"Argentina
The Falklands
Britain
Tom,Jerry and Spike meme",5,2,0,Argentina;Falklanda;Britain,cat;mouse;dog,None,None
image_ (2796).jpg,"get in loser we're deleting meme pages for ""hate speech""but leaving up kiddie porn and videos of people dying",1,3,0,,,,
image_ (1573).jpg,"I LEARNT A NEW MAGIC TRICK
WHAT'S IT LIKE?
IF U JUST BEND OVER,MY WAND WOULD JUST DISAPPEAR",7,2,0,,,,
image_ (3881).jpg,HAPPY BIRTHDAY RAHUL GANDHI,2,3,0,,,,
image_ (489).jpg,"CHOCOLATE COMES FROM COCOA.
WHICH IS A TREE. THAT MAKES IT A PLANT.
CHOCOLATE IS A SALAD
YOU'RE WELCOME",2,3,0,salad,chocolate,90,49
image_ (2961).jpg,"IF A TREE FALLS IN WASHINGTON
DOES ANYBODY HEAR IT OR IS IT OBAMA'S FAULT?",6,4,1,,,,
image_ (1116).jpg,"Chandler
Trolling on someone elss's account BEFORE IT WAS COOL.",1,3,0,,,,
image_ (3429).jpg,"PLEASE,TELL ME MORE ABOUT HOW SHE'S JUST A GOOD FRIEND!",1,2,0,,,,
image_ (1902).jpg,"HEY GIRL,THANK YOU.",2,2,0,,,,
image_ (3486).jpg,When you break up with America and start dating freedom...,1,3,0,,,,
image_ (160).jpg,Sometimes you just have to pick yourself up and carry on.,2,2,0,you,orange,None,57
image_ (2877).jpg,"Patrick Stewart
Patrick Stewart+20 years(in Star Trek)
Patrick Stewart+20 years(in Reality)",1,3,0,,,,
image_ (790).jpg,But I ❤ You,2,2,0,love,heart,None,220
image_ (656).jpg,"THEY SAY THE EYES ARE THE WINDOWS TO THE SOUL
BUT NOT MY EYES",4,3,0,window,eyes,162,191
image_ (3074).jpg,"THIS IS A MEME CHECKPOINT 
POST THE LAST MEME IN YOUR PHONE TO PASS",1,3,0,,,,
image_ (377).jpg,S D,4,2,0,A,mouth,None,193
image_ (998).jpg,WHAT IF THE BIG BANG WAS A RESET BUTTON FOR A PREVIOUS UNIVERSE THAT GOT MESSED UP,5,2,0,,,,
image_ (3526).jpg,"The dead are coming to kill everyine in Winterfell
Tormund:
The big woman still here?",5,4,1,,,,
image_ (1278).jpg,"OFFICER,
I SWEAR I ONLY HAD TWO BOOBS",5,3,1,,,,
image_ (2740).jpg,"SAYS HE'S THE ONLY ONE TOUGH ENOUGH TO STAND UP TO ISIS
THROW A HISSY FIT OVER SATURDAY NIGHT LIVE MAKING FUN OR HIM",4,4,0,,,,
image_ (797).jpg,"SH OK
HYUNSHOOK",7,2,0,o,mouth,None,193
image_ (1826).jpg,"NO ONE CARE WHAT I DO NO MORE 
BECAUSE DONALD TRUMP CRAZIER THAN ME",3,4,0,,,,
image_ (1487).jpg,"""How to defend against Cristiano Ronaaldo?By giving him as less space as possible  and not letting him to shoot with his right.Against Messi?By praying.""-Giorgio Chiellini
Giorgio Chiellini",4,3,0,,,,
image_ (2763).jpg,"THE MOST DANGEROUS THING IN THE WORLD
IS AN IMBECILE WHI THINKS HE'S A GENIUS!",3,4,0,,,,
image_ (434).jpg,When your team is trash but you still have fun playing,2,3,0,trash,your team,274,None
image_ (607).jpg,"No More Lyrics
Wolves in sheep's clothing",6,4,1,sheep,wolf,None,None
image_ (2129).jpg,"HAPPY BIRTHDAY
BRIAN,YOU STUD",1,2,0,,,,
image_ (3380).jpg,"LET NO ONE TELL YOU
YOU ARE UNIMPORTRTANT",3,2,0,,,,
image_ (3722).jpg,"I CALLED TAVIS SMILEY AND CORNELL WEAT UNCLE TOMS
BECAUSE I'M INSECURE ABOUT BEING THE BIGGEST COON IN HOLLYWOOD.",4,2,0,,,,
image_ (2419).jpg,"IT'S BEDTIME 
ARE YOU COMING OR NOT?",1,3,0,,,,
image_ (1594).jpg,"OW MY SCAR!
oh lol wait i'm not harry potter
One Does Not Simply Make A Lord of the Rings Page;)",7,2,0,,,,
image_ (1369).jpg,"Good know the exact number  of drinks you can handle before you  make poor choices  
Great friends  hand you that drink . 
som ee cards",1,3,0,,,,
image_ (1012).jpg,"THAT MONENT WHEN YOU REALIZE YOU GOT A GREAT ZOMBIEAPOCALIPSE TEAM IN THE BIG BANG THEORY WOMEN
THE VIRUS EXPERT
THE BRAIN EXPERT",1,3,0,,,,
image_ (1117).jpg,"JAN-ICE
JAN-ICE
JAN-ICE
Don't you know it yet?YOU LOVE ME CHANDLER BING.You seek me out.Something deep inside of you calls out to me like a foghorn",2,3,0,,,,
image_ (2602).jpg,Success,2,3,0,,,,
image_ (3836).jpg,Give me your lunch money!,3,3,0,,,,
image_ (869).jpg,"I AM SO AWESOME THAT WHEN I BAND SUPERMODELS
I CLOSE MY EYES AND PRETEND I'M ALONE",2,2,0,,,,
image_ (3370).jpg,"TO MY FAVORITE PERSON,Have A GREAT BIRTHDAY",1,2,0,,,,
image_ (3472).jpg,"This is bill.
Bill has a good camera.
Bill doesn't take unless pictures and call himself a photographer.
Bill is smart.
be like Bill.",1,2,0,,,,
image_ (3299).jpg,"When you upvote a meme and 
Then remember you are causing this meme to become normie",1,2,0,,,,
image_ (2207).jpg,"DAY 20
THEY STILL THINK I'M PENGUIN",1,3,0,penguin,cat,None,None
image_ (769).jpg,UNION IS STRENGTH,1,3,0,strength,union,None,None
image_ (3845).jpg,"When you see the madagascar penguin meme outlived it's 3 days
OH WELL!
YOU'LL JOIN US SOMEDAY!
What a bountiful harvest!",4,3,0,,,,
image_ (1868).jpg,"family:
me:",4,2,0,family;me,man;woman,None,None
image_ (3290).jpg,"I TOLD MYSELF I'D BE PRODUCTIVE TODAY
THE FACT YOU'RE REANING THIS RIGHT NOW DETRMINED THAT WAS A LIE",3,4,1,,,,
image_ (1334).jpg,"JOEY DOESNT  
SHARE FOOD",1,4,1,,,,
image_ (752).jpg,"Me Unsee Juice
(((Big sip)))",2,3,0,me,bird,None,None
image_ (3405).jpg,"When you say ""it's ok don't cry""but they start having an emotional breakdown anyway & you end up stuck cause your not the comforting type",4,2,0,,,,
image_ (2906).jpg,"PROBABLY THE ONLY VILLIAN
WHO WAS LOVED MORE THAN THE HERO",3,3,0,,,,
image_ (888).jpg,When You've Been Playing Pokemon Go And Have No Idea Where You  Are Now...,7,2,0,you,Mr.Bean,None,None
image_ (3005).jpg,"ALL GOOD THINGS START WITH A 
EXAMPLE: A DOCTOR, A LAWYER.",2,3,0,,,,
image_ (1811).jpg,"JOKER LOVES CHAOS
NOT AMUSED ABOUT AFFLECK",6,3,0,,,,
image_ (2234).jpg,"WHEN YOU LOOSE YOUR PHONE FOR A WEEK
AND YOU FIND IT
Memes",1,2,1,memes;you,oxygen;sad frog,None,None
image_ (1726).jpg,"CREATES RACIST PARTY
PROMOTES WORLDWIDE EQUALITY AFTER DEATH",3,4,1,,,,
image_ (2701).jpg,"""Legend has it the titanic sank with 300 unseen memes onboard"" Me:",7,2,0,,,,
image_ (478).jpg,PATIENCE IS A VIRTUE,2,3,0,virtue,patience,None,None
image_ (1456).jpg,"SO I'VE NEVER HAD A GIRLFRIEND
BUT I HAVE NO EX-GIRLFRIENDS,SO I GOT THAT GOIN' FOR ME WHICH IS NICE",4,2,0,,,,
image_ (2485).jpg,Life is this.I like this.,1,3,0,life,height,None,None
image_ (666).jpg,"Coffee
a liquid hug for your brain",2,3,0,hug,coffee,None,183
image_ (1980).jpg,"When your parents told you the divorce wasn't your fault,they lied.",3,3,0,,,,
image_ (524).jpg,I SAW THE LIGHT,2,3,0,light,bulb,None,127
image_ (3951).jpg,"You've been hit by
You've been struck by A smooth criminal",3,1,0,,,,
image_ (3495).jpg,"""ALL OF THE OTHER REINDEER USED TO LAUCH AND CALL HIM NAMES...""
GOOD.",3,3,0,,,,
image_ (2263).jpg,"THANK YOU
GLAD TO SEE SOMEONE WITH A LITTLE CIVIL DECENCY",2,2,0,,,,
image_ (3856).jpg,"The only good thing about going to the recent page, is seing the few good memes before everyone else does.
Not really sure if it's that much win..",1,2,0,,,,
image_ (1406).jpg,Joe pays homage to Gene Wilder in the best way.,1,3,0,,,,
image_ (1174).jpg,"SORRY I FORGOT TO
CONGRATULATE YOU ON
YOUR BIRTHDAY,SO
HERE'S DEADPOOL WITH A...
CHIMICHANGA!",4,1,0,,,,
image_ (402).jpg,SO MUCH COCAINE,6,4,1,cocaine,snow,283,148
image_ (3319).jpg,KIM JONG-UN LOOKING AT SUN.SUN ONLY FALLS ON LIM JONG-UN,1,4,0,,,,
image_ (1120).jpg,CHUCK NORRIS STARED AT THE SOLAR ECLIPSE TOO LONG AND THE SUN WENT BLIND,1,3,0,,,,
image_ (3461).jpg,"WHY THE HELL IS A COVERNMENT THAT SPIES ON ITS OWN CITIZENS
LECTURING MARK ZUCKERBERG ABOUT PRIVACY?!",3,2,0,,,,
